{
  "$schema": "https://json-schema.org/draft/2020-12/schema",
  "$id": "tool-definition.schema.json",
  "title": "Tool Definition",
  "description": "Definition of a tool available to agents. Tools are external capabilities (APIs, services, utilities) that agents can invoke. The Runtime uses this schema to: 1) Inject tool definitions into LLM function calling, 2) Validate tool arguments before execution, 3) Provide helpful error messages for invalid calls.\n\nTOOL vs CAPABILITY: A 'capability' in agent.schema.json grants permission to use a tool. A 'tool-definition' defines the tool's interface (what arguments it accepts). Both are needed: the studio defines tools, agents are granted capabilities to use them.",

  "type": "object",
  "required": ["id", "name", "description"],

  "properties": {
    "id": {
      "$ref": "_definitions.schema.json#/$defs/id",
      "description": "Unique identifier for this tool"
    },

    "name": {
      "$ref": "_definitions.schema.json#/$defs/name",
      "description": "Human-readable name shown in function calling UI"
    },

    "description": {
      "$ref": "_definitions.schema.json#/$defs/markdown_text",
      "description": "What this tool does - included in LLM context to help it decide when to use the tool"
    },

    "summary": {
      "$ref": "_definitions.schema.json#/$defs/summary",
      "description": "Concise one-liner for prompt injection. Use description for full explanation."
    },

    "concise_description": {
      "type": "string",
      "description": "Simplified description for small models (8B and under). Drops nuances that small models cannot handle. If not specified, falls back to description. Use this to provide a shorter, more direct explanation suitable for limited context windows."
    },

    "cost_tier": {
      "type": "string",
      "enum": ["low", "medium", "high", "external"],
      "description": "Advisory cost tier for orchestration and UI. 'low' = cheap/fast, 'medium' = moderate cost, 'high' = expensive API calls, 'external' = triggers external services/commissions. Not hard budgeting - guides orchestrator decisions."
    },

    "input_schema": {
      "$ref": "#/$defs/tool_input_schema",
      "description": "JSON Schema defining the tool's arguments (function signature)"
    },

    "output_schema": {
      "$ref": "#/$defs/tool_output_schema",
      "description": "Optional schema for the tool's return value (for documentation and runtime validation)"
    },

    "secrets_required": {
      "type": "array",
      "items": { "type": "string" },
      "default": [],
      "description": "Environment variables the Runtime needs to execute this tool (e.g., 'OPENAI_API_KEY', 'DATABASE_URL'). Runtime validates these exist before enabling the tool."
    },

    "rate_limit": {
      "$ref": "#/$defs/rate_limit",
      "description": "Optional rate limiting configuration"
    },

    "timeout_ms": {
      "type": "integer",
      "minimum": 100,
      "default": 30000,
      "description": "Maximum execution time in milliseconds before the tool call times out"
    },

    "retry_policy": {
      "$ref": "#/$defs/retry_policy",
      "description": "How to handle transient failures"
    },

    "examples": {
      "type": "array",
      "items": {
        "$ref": "#/$defs/tool_example"
      },
      "default": [],
      "description": "Example invocations to help agents understand usage patterns"
    },

    "terminates_turn": {
      "type": "boolean",
      "default": false,
      "description": "If true, calling this tool ends the agent's turn (yields control). The agent suspends and expects to resume later. This does NOT mean 'I'm done with my work' - it means 'yield control, expect to continue'. Runtime enforces: orchestrator agents MUST end every turn with a terminating tool call (e.g., delegate, communicate). Non-orchestrators may use prose output."
    },

    "terminates_session": {
      "type": "boolean",
      "default": false,
      "description": "If true, calling this tool ends the entire session. This is the ONLY way to signal 'I'm done with my work forever'. Only meaningful for orchestrator agents. Use for explicit session completion or fatal errors. Most tools that terminates_turn do NOT terminate session - they yield control expecting to resume."
    },

    "can_reject": {
      "type": "boolean",
      "default": false,
      "description": "If true, this tool may reject work even when execution succeeds (e.g., validation failures, permission denied). When can_reject=true and result contains action_outcome='rejected', it doesn't count as progress for iteration limits. Use for tools that validate or gate content."
    },

    "summarization_policy": {
      "$ref": "#/$defs/summarization_policy",
      "description": "How to summarize this tool's result when context needs to be compressed. Used by the Secretary pattern to manage context growth."
    },

    "summary_template": {
      "type": "string",
      "description": "Template for concise/ultra_concise summaries. Variables in {braces} are replaced from tool result. Example: 'Delegated to {to_agent}' or 'Schema for {artifact_type} retrieved'."
    }
  },

  "additionalProperties": false,

  "$defs": {
    "tool_input_schema": {
      "type": "object",
      "description": "JSON Schema for tool arguments. The Runtime validates agent tool calls against this schema before execution.",
      "properties": {
        "type": {
          "const": "object",
          "description": "Tool inputs are always objects"
        },
        "properties": {
          "type": "object",
          "additionalProperties": {
            "type": "object",
            "description": "JSON Schema for each argument"
          },
          "description": "The tool's arguments"
        },
        "required": {
          "type": "array",
          "items": { "type": "string" },
          "description": "Which arguments are required"
        }
      },
      "additionalProperties": true
    },

    "tool_output_schema": {
      "type": "object",
      "description": "JSON Schema for tool return value. Optional - used for documentation and optional runtime validation.",
      "additionalProperties": true
    },

    "rate_limit": {
      "type": "object",
      "properties": {
        "requests_per_minute": {
          "type": "integer",
          "minimum": 1,
          "description": "Maximum calls per minute across all agents"
        },
        "requests_per_agent_per_minute": {
          "type": "integer",
          "minimum": 1,
          "description": "Maximum calls per minute per agent"
        },
        "burst_limit": {
          "type": "integer",
          "minimum": 1,
          "description": "Maximum concurrent calls"
        }
      },
      "additionalProperties": false
    },

    "retry_policy": {
      "type": "object",
      "properties": {
        "max_retries": {
          "type": "integer",
          "minimum": 0,
          "default": 3,
          "description": "Maximum retry attempts"
        },
        "initial_delay_ms": {
          "type": "integer",
          "minimum": 100,
          "default": 1000,
          "description": "Initial delay before first retry"
        },
        "backoff_multiplier": {
          "type": "number",
          "minimum": 1,
          "default": 2,
          "description": "Multiplier for exponential backoff"
        },
        "retryable_errors": {
          "type": "array",
          "items": { "type": "string" },
          "default": ["timeout", "rate_limited", "service_unavailable"],
          "description": "Error types that trigger retry"
        }
      },
      "additionalProperties": false
    },

    "tool_example": {
      "type": "object",
      "required": ["description", "input"],
      "properties": {
        "description": {
          "type": "string",
          "description": "What this example demonstrates"
        },
        "input": {
          "type": "object",
          "description": "Example input arguments"
        },
        "output": {
          "description": "Expected output (for documentation)"
        }
      },
      "additionalProperties": false
    },

    "summarization_policy": {
      "type": "string",
      "enum": ["drop", "ultra_concise", "concise", "preserve"],
      "default": "preserve",
      "description": "Policy for summarizing tool results when compressing context:\n- drop: Remove from summarized context (tool can be re-called if needed, e.g., schema lookups)\n- ultra_concise: Single-line summary using summary_template (e.g., 'Delegated to Plotwright')\n- concise: Brief multi-line summary preserving key facts\n- preserve: Keep full result in context (default, for critical data)"
    }
  }
}
