{
  "$schema": "../../meta/schemas/core/tool-definition.schema.json",
  "id": "return_to_orchestrator",
  "name": "Return to Orchestrator",
  "summary": "Signal task completion and return control",
  "description": "Signal that your delegated task is complete and return control to the orchestrator.\n\nRequired fields:\n- summary: What you accomplished\n- result_assessment: pass/partial/fail/skip/info\n- recommendation: proceed/rework/escalate/hold\n\nIf you created or updated artifacts, include artifacts_produced with their IDs. This is CRITICAL for workflow continuity - without IDs, the orchestrator cannot pass your work to the next agent.",
  "terminates_turn": true,
  "summarization_policy": "ultra_concise",
  "summary_template": "Returned to orchestrator: {result_assessment} - {summary}",
  "input_schema": {
    "type": "object",
    "properties": {
      "reasoning": {
        "type": "string",
        "description": "Explain why you are calling this tool and what you expect to achieve. This helps ensure thoughtful tool usage."
      },
      "summary": {
        "type": "string",
        "description": "Brief summary of what was accomplished or what's blocking progress"
      },
      "result_assessment": {
        "type": "string",
        "enum": [
          "pass",
          "partial",
          "fail",
          "skip",
          "info"
        ],
        "description": "Quality assessment of your work product: pass (all good), partial (some issues found), fail (major problems), skip (not applicable to this task), info (informational only, no quality judgment)"
      },
      "recommendation": {
        "type": "string",
        "enum": [
          "proceed",
          "rework",
          "escalate",
          "hold"
        ],
        "description": "What the orchestrator should do next: proceed (continue workflow), rework (route back for fixes), escalate (needs human decision), hold (blocked, cannot continue)"
      },
      "artifacts_produced": {
        "type": "array",
        "items": {
          "type": "string"
        },
        "description": "IDs of artifacts created or updated during this work"
      },
      "artifacts_ready_for_review": {
        "type": "array",
        "items": {
          "type": "string"
        },
        "description": "IDs of artifacts that are ready for quality gating"
      },
      "blockers": {
        "type": "array",
        "items": {
          "type": "object",
          "properties": {
            "type": {
              "type": "string",
              "enum": [
                "missing_input",
                "quality_issue",
                "canon_conflict",
                "needs_clarification",
                "other"
              ]
            },
            "description": {
              "type": "string"
            }
          }
        },
        "description": "If there are issues, what specifically is problematic"
      }
    },
    "required": [
      "reasoning",
      "summary",
      "result_assessment",
      "recommendation"
    ]
  },
  "output_schema": {
    "type": "object",
    "properties": {
      "acknowledged": {
        "type": "boolean",
        "description": "Whether the return was successfully processed"
      },
      "message_id": {
        "type": "string",
        "description": "ID of the delegation_response message sent to orchestrator"
      }
    }
  },
  "examples": [
    {
      "description": "Scene Smith completes section drafting successfully",
      "input": {
        "summary": "Drafted section prose for SB-005 with 3 choices as specified in the brief",
        "result_assessment": "pass",
        "recommendation": "proceed",
        "artifacts_produced": [
          "section-lighthouse-lock-v1"
        ],
        "artifacts_ready_for_review": [
          "section-lighthouse-lock-v1"
        ]
      }
    },
    {
      "description": "Plotwright blocked by missing canon",
      "input": {
        "summary": "Cannot complete topology for Act 2 - lighthouse backstory not established",
        "result_assessment": "fail",
        "recommendation": "hold",
        "blockers": [
          {
            "type": "missing_input",
            "description": "Need lighthouse history and keeper's motivation from canon"
          }
        ]
      }
    },
    {
      "description": "Gatekeeper finds quality issues that need rework",
      "input": {
        "summary": "Gatecheck complete - 6/8 bars pass, 2 need rework",
        "result_assessment": "partial",
        "recommendation": "rework",
        "artifacts_produced": [
          "gatecheck-section-005"
        ],
        "blockers": [
          {
            "type": "quality_issue",
            "description": "Choice Integrity: options 2 and 3 are near-synonyms"
          },
          {
            "type": "quality_issue",
            "description": "Nonlinearity: missing return path from dead end"
          }
        ]
      }
    },
    {
      "description": "Gatekeeper pre-gate review (reachability is informational only)",
      "input": {
        "summary": "Pre-gate review complete - Integrity and Nonlinearity pass, Reachability deferred to post-Scene Weave",
        "result_assessment": "info",
        "recommendation": "proceed",
        "artifacts_produced": [
          "pregate-report-section-briefs"
        ]
      }
    }
  ]
}
