{
  "$schema": "../../meta/schemas/core/tool-definition.schema.json",
  "id": "analyze_story_graph",
  "name": "Analyze Story Graph",
  "summary": "Analyze narrative structure topology",
  "description": "Programmatically analyzes story topology to check reachability, dead ends, orphans, missing targets, and lifecycle status. Provides concrete data for structural analysis without requiring LLM reasoning about graph structure.\n\nChecks:\n1. Reachability - Can all nodes be reached from entry?\n2. Dead ends - Nodes with no outgoing connections\n3. Orphans - Nodes with no incoming connections (except entry)\n4. Missing targets - References to non-existent nodes\n5. Lifecycle status - What state are the paths in?\n\nReturns structured analysis with actionable recommendations.",

  "summarization_policy": "preserve",

  "input_schema": {
    "type": "object",
    "properties": {
      "include_drafts": {
        "type": "boolean",
        "default": true,
        "description": "Whether to include draft lifecycle nodes in analysis"
      },
      "entry_anchor": {
        "type": "string",
        "description": "Optional explicit entry point anchor. If not provided, nodes with no incoming connections are treated as entry points."
      }
    }
  },

  "output_schema": {
    "type": "object",
    "description": "Semantically clear analysis result (see issue #228 for rationale)",
    "properties": {
      "analysis_outcome": {
        "type": "string",
        "enum": ["passed", "warnings", "failed"],
        "description": "Analysis outcome: passed (no issues), warnings (non-blocking concerns), failed (blocking issues)"
      },
      "blocking_issues": {
        "type": "array",
        "description": "Issues that prevent graph approval - must be fixed",
        "items": {
          "type": "object",
          "properties": {
            "issue_type": { "type": "string", "enum": ["missing_targets", "no_entry_point"] },
            "severity": { "type": "string", "enum": ["blocking"] },
            "description": { "type": "string" },
            "affected_nodes": { "type": "array", "items": { "type": "string" } },
            "count": { "type": "integer" }
          }
        }
      },
      "warnings": {
        "type": "array",
        "description": "Non-blocking concerns - should be reviewed",
        "items": {
          "type": "object",
          "properties": {
            "issue_type": { "type": "string", "enum": ["unreachable_nodes", "multiple_entry_points", "dead_ends", "orphan_nodes", "no_stable_paths"] },
            "severity": { "type": "string", "enum": ["warning"] },
            "description": { "type": "string" },
            "affected_nodes": { "type": "array", "items": { "type": "string" } },
            "count": { "type": "integer" }
          }
        }
      },
      "recovery_actions": {
        "type": "array",
        "description": "Directive actions to fix issues (not passive hints)",
        "items": {
          "type": "object",
          "properties": {
            "priority": { "type": "string", "enum": ["high", "medium", "low", "info"] },
            "action": { "type": "string", "description": "What to do" },
            "details": { "type": "string", "description": "Specific details" }
          }
        }
      },
      "analysis": {
        "type": "object",
        "description": "Detailed graph analysis data",
        "properties": {
          "summary": {
            "type": "object",
            "properties": {
              "total_nodes": { "type": "integer" },
              "entry_points": { "type": "array", "items": { "type": "string" } },
              "reachable_count": { "type": "integer" },
              "unreachable_count": { "type": "integer" },
              "dead_end_count": { "type": "integer" },
              "orphan_count": { "type": "integer" },
              "missing_target_count": { "type": "integer" },
              "has_reachable_stable_node": { "type": "boolean" }
            }
          },
          "reachable": { "type": "array", "items": { "type": "string" } },
          "unreachable": { "type": "array", "items": { "type": "string" } },
          "dead_ends": { "type": "array", "items": { "type": "string" } },
          "orphans": { "type": "array", "items": { "type": "string" } },
          "missing_targets": {
            "type": "array",
            "items": {
              "type": "object",
              "properties": {
                "from": { "type": "string" },
                "to": { "type": "string" }
              }
            }
          },
          "by_lifecycle": {
            "type": "object",
            "additionalProperties": { "type": "array", "items": { "type": "string" } }
          },
          "nodes": {
            "type": "object",
            "additionalProperties": {
              "type": "object",
              "properties": {
                "anchor_id": { "type": "string" },
                "artifact_id": { "type": "string" },
                "title": { "type": "string" },
                "lifecycle_state": { "type": "string" },
                "type": { "type": "string", "enum": ["section_brief", "section"] },
                "outgoing": { "type": "array", "items": { "type": "string" } },
                "incoming": { "type": "array", "items": { "type": "string" } }
              }
            }
          }
        }
      }
    }
  },

  "examples": [
    {
      "description": "Full story graph validation",
      "input": {}
    },
    {
      "description": "Validate from specific entry point, excluding drafts",
      "input": {
        "entry_anchor": "opening_scene",
        "include_drafts": false
      }
    }
  ]
}
