{
  "$schema": "../../meta/schemas/core/tool-definition.schema.json",
  "id": "request_clarification",
  "name": "Request Clarification",
  "description": "Ask the customer (human) a clarifying question. Use this when you need more information, want to confirm understanding, or need a decision before proceeding.\n\nThis pauses the workflow and returns control to the human. Their response will be provided in your next activation.\n\nUse this instead of making assumptions when requirements are ambiguous.",

  "input_schema": {
    "type": "object",
    "properties": {
      "question": {
        "type": "string",
        "description": "The question to ask the customer"
      },
      "context": {
        "type": "string",
        "description": "Why this clarification is needed - helps the customer understand the importance"
      },
      "options": {
        "type": "array",
        "items": {
          "type": "object",
          "properties": {
            "id": {
              "type": "string",
              "description": "Short identifier for this option"
            },
            "description": {
              "type": "string",
              "description": "What this option means"
            },
            "implications": {
              "type": "string",
              "description": "What choosing this option would lead to"
            }
          },
          "required": ["id", "description"]
        },
        "description": "Optional: present structured choices to the customer"
      },
      "default_option": {
        "type": "string",
        "description": "If options provided, which one you'd recommend if the customer doesn't respond"
      }
    },
    "required": ["question"]
  },

  "output_schema": {
    "type": "object",
    "properties": {
      "status": {
        "type": "string",
        "enum": ["pending", "answered"],
        "description": "Whether the customer has responded yet"
      },
      "selected_option": {
        "type": "string",
        "description": "If options were provided, which one was selected"
      },
      "answer": {
        "type": "string",
        "description": "The customer's free-form response"
      }
    }
  },

  "examples": [
    {
      "description": "Ask about story tone",
      "input": {
        "question": "What tone would you like for this story?",
        "context": "The tone will affect word choice, pacing, and themes throughout.",
        "options": [
          { "id": "dark", "description": "Dark and serious", "implications": "Gothic atmosphere, moral ambiguity" },
          { "id": "light", "description": "Light and adventurous", "implications": "Upbeat pacing, clear heroes/villains" },
          { "id": "balanced", "description": "Balanced mix", "implications": "Varies by scene as appropriate" }
        ],
        "default_option": "balanced"
      }
    },
    {
      "description": "Confirm understanding",
      "input": {
        "question": "Just to confirm: you want a mystery story set in a Victorian mansion with 3 acts?",
        "context": "I want to make sure I understood your request correctly before starting."
      }
    }
  ]
}
