{
  "$schema": "../../meta/schemas/core/tool-definition.schema.json",
  "id": "generate_image",
  "name": "Generate Image",
  "summary": "Generate an image from a plan",
  "description": "Generate an illustration from an Art Plan. Consults Reference Sheets for visual consistency of recurring elements (characters, locations, objects). Returns an image asset with determinism log (kept off-surface).\n\nThis tool is expensive\u2014use only when budget allows. Art Plans should exist for ALL worthy scenes, but generation is selective based on priority.\n\nRuntime provides implementation (DALL-E, Stable Diffusion, commission queue, etc.).",
  "cost_tier": "high",
  "summarization_policy": "ultra_concise",
  "summary_template": "Generated image from {source_plan}",
  "input_schema": {
    "type": "object",
    "properties": {
      "reasoning": {
        "type": "string",
        "description": "Explain why you are calling this tool and what you expect to achieve. This helps ensure thoughtful tool usage."
      },
      "art_plan_ref": {
        "type": "string",
        "description": "Reference to the Art Plan artifact (e.g., 'AP-001')"
      },
      "style_guide_ref": {
        "type": "string",
        "description": "Reference to the Style Guide for visual language guidance"
      },
      "reference_sheet_refs": {
        "type": "array",
        "items": {
          "type": "string"
        },
        "description": "References to Reference Sheets for recurring elements in this image (characters, locations, objects)"
      },
      "output_format": {
        "type": "string",
        "enum": [
          "png",
          "jpeg",
          "webp"
        ],
        "default": "png",
        "description": "Output image format"
      },
      "dimensions": {
        "type": "object",
        "properties": {
          "width": {
            "type": "integer",
            "minimum": 256,
            "maximum": 4096
          },
          "height": {
            "type": "integer",
            "minimum": 256,
            "maximum": 4096
          }
        },
        "description": "Target dimensions. If not specified, uses Art Plan guidance or defaults."
      },
      "variants_requested": {
        "type": "integer",
        "minimum": 1,
        "maximum": 4,
        "default": 1,
        "description": "Number of variants to generate for selection"
      }
    },
    "required": [
      "reasoning",
      "art_plan_ref"
    ]
  },
  "output_schema": {
    "type": "object",
    "properties": {
      "asset": {
        "type": "object",
        "description": "The generated illustration asset",
        "properties": {
          "asset_id": {
            "type": "string"
          },
          "file_path": {
            "type": "string"
          },
          "file_hash": {
            "type": "string"
          },
          "mime_type": {
            "type": "string"
          },
          "size_bytes": {
            "type": "integer"
          },
          "width": {
            "type": "integer"
          },
          "height": {
            "type": "integer"
          }
        }
      },
      "source_plan": {
        "type": "string",
        "description": "Reference to the Art Plan this was generated from"
      },
      "determinism_log": {
        "type": "object",
        "description": "Off-surface generation details for reproducibility",
        "properties": {
          "tool": {
            "type": "string",
            "description": "Generation tool used (e.g., 'dalle-3', 'sdxl')"
          },
          "prompt_hash": {
            "type": "string",
            "description": "Hash of the prompt used"
          },
          "seed": {
            "type": [
              "integer",
              "null"
            ],
            "description": "Seed if deterministic generation supported"
          },
          "model_version": {
            "type": "string"
          },
          "settings": {
            "type": "object",
            "description": "Tool-specific settings"
          },
          "timestamp": {
            "type": "string",
            "format": "date-time"
          }
        }
      },
      "variants": {
        "type": "array",
        "description": "If multiple variants requested, all generated options",
        "items": {
          "type": "object",
          "properties": {
            "variant_id": {
              "type": "string"
            },
            "file_path": {
              "type": "string"
            },
            "selected": {
              "type": "boolean"
            }
          }
        }
      }
    }
  },
  "timeout_ms": 120000,
  "retry_policy": {
    "max_retries": 1,
    "initial_delay_ms": 5000,
    "backoff_multiplier": 2,
    "retryable_errors": [
      "timeout",
      "service_unavailable"
    ]
  },
  "rate_limit": {
    "requests_per_minute": 10,
    "requests_per_agent_per_minute": 5
  },
  "examples": [
    {
      "description": "Generate illustration for a signpost scene",
      "input": {
        "art_plan_ref": "AP-001",
        "style_guide_ref": "SG-001",
        "reference_sheet_refs": [
          "RS-foreman"
        ],
        "output_format": "png",
        "variants_requested": 2
      }
    },
    {
      "description": "Generate mood plate without characters",
      "input": {
        "art_plan_ref": "AP-015",
        "style_guide_ref": "SG-001",
        "output_format": "webp",
        "dimensions": {
          "width": 1920,
          "height": 1080
        }
      }
    }
  ]
}
