{
  "$schema": "../../meta/schemas/core/tool-definition.schema.json",
  "id": "list_agents",
  "name": "List Agents",
  "summary": "List available agents and their capabilities",
  "description": "List all agents available for delegation. Use this to discover what specialist agents exist and their archetypes before delegating work. Returns a compact list with id, name, archetypes, and brief description.",
  "summarization_policy": "drop",
  "summary_template": "Listed {count} agents",
  "input_schema": {
    "type": "object",
    "properties": {
      "reasoning": {
        "type": "string",
        "description": "Explain why you are calling this tool and what you expect to achieve. This helps ensure thoughtful tool usage."
      }
    },
    "required": [
      "reasoning"
    ]
  },
  "output_schema": {
    "type": "object",
    "properties": {
      "agents": {
        "type": "array",
        "description": "List of agents with id, name, archetypes, description"
      },
      "count": {
        "type": "integer",
        "description": "Number of agents"
      }
    }
  },
  "examples": [
    {
      "description": "Discover available agents for delegation",
      "input": {
        "reasoning": "I want to see which specialist agents are available so I can decide which one to delegate my task to"
      },
      "output": {
        "agents": [
          {
            "id": "plotwright",
            "name": "Plotwright",
            "archetypes": [
              "architect"
            ],
            "description": "Designs story topology and structure"
          },
          {
            "id": "scene_smith",
            "name": "Scene Smith",
            "archetypes": [
              "author",
              "creator"
            ],
            "description": "Transforms skeleton scenes into engaging prose"
          }
        ],
        "count": 2
      }
    }
  ]
}
